Keyword Phrase,Search Volume (Monthly, Approx.),Keyword Difficulty (KD, 0-100),Intent (Informational, Navigational, Commercial, Transactional),Target Persona(s),Notes/Content Ideas
"ai in workplace strategy",500,45,Informational,P1 (HR Manager),Blog post: How AI is Revolutionizing Workplace Design; Webinar
"hybrid office optimization solutions",300,55,Commercial,P2 (Operations Director),Case Study: Optimizing Hybrid Office for Company X; Service Page
"prop-tech ai startups europe",150,60,Informational/Commercial,P3 (Investor/Partner),Article: Top Prop-Tech AI Innovations to Watch in Europe; Competitor analysis snippet
"future of office space technology",800,50,Informational,P1, P2,Blog series: The Smart Office of Tomorrow
"cost-effective office reconfiguration",200,40,Transactional,P2 (Operations Director),Landing Page: Get a Quote for Office Reconfiguration
